{
  "schemaVersion": "lab-scenario/v1",
  "id": "p01-basic-id-login",
  "seed": 101,
  "tags": ["smoke", "selectors", "runtime-pass", "vertical-slice"],
  "source": {
    "language": "csharp",
    "testFramework": "nunit",
    "template": "single-project",
    "features": ["FindElement", "By.Id", "SendKeys", "Click", "Assert.That"]
  },
  "project": {
    "files": ["Scenario.csproj", "Tests/LoginTests.cs"],
    "references": [],
    "msBuild": { "nullable": true, "implicitUsings": true, "fileScopedNamespace": true }
  },
  "app": {
    "pages": [
      {
        "path": "/login",
        "model": "form",
        "elements": ["username", "password", "login", "result"],
        "events": ["auth:attempt", "auth:success"]
      }
    ]
  },
  "oracle": {
    "source": { "mustPassTests": 1 },
    "target": { "mustPassTests": 1 },
    "semantic": {
      "events": ["auth:attempt", "auth:success"],
      "dom": [{ "selector": "#result", "text": "ok", "visible": true }]
    }
  },
  "qualityBudget": { "todoMax": 0, "unmappedMax": 0, "unsupportedMax": 0, "warningsMax": 0 },
  "expected": { "status": "PASS" },
  "implementation": {
    "state": "PLANNED",
    "block": "02-fixtures-labapp",
    "notes": "First happy-path source/runtime fixture."
  }
}
